{"schemaVersion":"1.0.0","batchId":"BR-900-rehearsal","fingerprint":"4b4c807c88c2ece00291fda87a18cb425111101c21ac5cd4662067e609597046","outcome":"REVIEW_READY","checkedAt":"2026-09-24T14:12:06.324Z","confirmation":{"path":"specs/batches/BR-900-rehearsal/records/confirmation-4b4c807c88c2.json","sha256":"58df15b47df76340686237918e5fdfb4d18abc2b31ee2d391e941b27b63d653f"},"semanticReport":{"sha256":"f25491a53541bb64a9cca57b986126cda570332711c7113e23d5912eadc8a193"},"mechanical":[{"code":"REVIEW_SECTION_UNRECOGNIZED","severity":"advisory","message":"unrecognized section: Spec：Greeting","path":"specs/features/greeting/spec.md","locator":{"path":"specs/features/greeting/spec.md","anchor":"Spec：Greeting","blockSha256":"8847ec2ed99f127c9582208823628903fc09280b8d39afa9e71a180d143792bc"}}],"semantic":[],"expect":null}