{"schemaVersion":"1.0.0","batchId":"BR-900-rehearsal","fingerprint":"4b4c807c88c2ece00291fda87a18cb425111101c21ac5cd4662067e609597046","outcome":"REVIEW_INCOMPLETE","checkedAt":"2026-09-24T09:54:43.407Z","confirmation":null,"semanticReport":null,"mechanical":[{"code":"REVIEW_CONFIRMATION_MISSING","severity":"blocking","message":"no confirmation record applies to the current fingerprint"},{"code":"REVIEW_SEMANTIC_MISSING","severity":"blocking","message":"no Semantic Report was provided"},{"code":"REVIEW_SECTION_UNRECOGNIZED","severity":"advisory","message":"unrecognized section: Spec：Greeting","path":"specs/features/greeting/spec.md","locator":{"path":"specs/features/greeting/spec.md","anchor":"Spec：Greeting","blockSha256":"8847ec2ed99f127c9582208823628903fc09280b8d39afa9e71a180d143792bc"}}],"semantic":[],"expect":null}