{"schemaVersion":"1.0.0","batchId":"BR-900-rehearsal","fingerprint":"a991b80e2cd055f94654e848b4ffbbb8fb0f70498fed663e8b8295df2fe0b93e","outcome":"REVIEW_STALE","checkedAt":"2026-09-24T14:13:44.921Z","confirmation":null,"semanticReport":{"sha256":"f25491a53541bb64a9cca57b986126cda570332711c7113e23d5912eadc8a193"},"mechanical":[{"code":"REVIEW_CONFIRMATION_STALE","severity":"blocking","message":"the latest valid confirmation was made for a different fingerprint"},{"code":"REVIEW_PACKET_FINGERPRINT_MISMATCH","severity":"blocking","message":"expected fingerprint 4b4c807c88c2ece00291fda87a18cb425111101c21ac5cd4662067e609597046 does not match the current fingerprint a991b80e2cd055f94654e848b4ffbbb8fb0f70498fed663e8b8295df2fe0b93e"},{"code":"REVIEW_SEMANTIC_STALE","severity":"blocking","message":"Semantic Report fingerprint does not match the current fingerprint"},{"code":"STORY_AUTHORITY_ENTRY_INVALID","severity":"blocking","message":"authority entry is not a declaration: Also greet an empty name as `Hello, friend!`.","path":"specs/stories/FX-003-greet-readme"},{"code":"STORY_AUTHORITY_ENTRY_INVALID","severity":"blocking","message":"authority entry is not a declaration: Also greet an empty name as `Hello, friend!`.","path":"specs/stories/FX-003-greet-readme"},{"code":"REVIEW_READINESS_STALE","severity":"blocking","message":"readiness.json digests do not match the current story.md/acceptance.md bytes: specs/stories/FX-003-greet-readme","path":"specs/stories/FX-003-greet-readme"},{"code":"REVIEW_SECTION_UNRECOGNIZED","severity":"advisory","message":"unrecognized section: Spec：Greeting","path":"specs/features/greeting/spec.md","locator":{"path":"specs/features/greeting/spec.md","anchor":"Spec：Greeting","blockSha256":"8847ec2ed99f127c9582208823628903fc09280b8d39afa9e71a180d143792bc"}},{"code":"REVIEW_SOURCE_CHANGED","severity":"advisory","message":"source changed since the latest valid confirmation","path":"specs/stories/FX-003-greet-readme/story.md"}],"semantic":[],"expect":{"fingerprint":"4b4c807c88c2ece00291fda87a18cb425111101c21ac5cd4662067e609597046"}}