{"schemaVersion":"1.0.0","batchId":"BR-935-rehearsal","fingerprint":"d45922f0a60f3a829ac61453428415994d56951477da8b5f3c8a4cf82de6c19a","outcome":"REVIEW_READY","checkedAt":"2026-09-26T03:37:30.272Z","confirmation":{"path":"specs/batches/BR-935-rehearsal/records/confirmation-d45922f0a60f.json","sha256":"970770274b267062b1c53ca0b08ee1feaffa983fb888a44d7c57cf9cb977d73b"},"semanticReport":{"sha256":"ae1ba1625ea3547a474e394ef06c8e6389b8dd06147dd411f672a2e70a4cbe37"},"mechanical":[{"code":"REVIEW_SECTION_UNRECOGNIZED","severity":"advisory","message":"unrecognized section: Spec：Greeting","path":"specs/features/greeting/spec.md","locator":{"path":"specs/features/greeting/spec.md","anchor":"Spec：Greeting","blockSha256":"8847ec2ed99f127c9582208823628903fc09280b8d39afa9e71a180d143792bc"}}],"semantic":[],"expect":{"fingerprint":"d45922f0a60f3a829ac61453428415994d56951477da8b5f3c8a4cf82de6c19a"}}