{"schemaVersion":"1.0.0","batchId":"BR-936-inconsistent","fingerprint":"af9f3f27b6377ccac9863d8af568f50d8dc52872f1e44aa407da0f92fc81f146","outcome":"REVIEW_READY","checkedAt":"2026-09-25T18:24:07.984Z","confirmation":{"path":"specs/batches/BR-936-inconsistent/records/confirmation-af9f3f27b637.json","sha256":"056eaa5f1f5617c9004cc9ee86fb995dff2c39cc7e198f4e6df604a10e023944"},"semanticReport":{"sha256":"bcc153556bf25e347e74b879c9b237039a9937f433aa9508708c568dbce5c0d1"},"mechanical":[{"code":"REVIEW_SECTION_UNRECOGNIZED","severity":"advisory","message":"unrecognized section: Spec：Greeting","path":"specs/features/greeting/spec.md","locator":{"path":"specs/features/greeting/spec.md","anchor":"Spec：Greeting","blockSha256":"8847ec2ed99f127c9582208823628903fc09280b8d39afa9e71a180d143792bc"}}],"semantic":[],"expect":{"fingerprint":"af9f3f27b6377ccac9863d8af568f50d8dc52872f1e44aa407da0f92fc81f146"}}